{
  "$schema": "http://json-schema.org/draft-07/schema#",
  "type": "object",
  "required": ["type", "timestamp", "userId", "payload"],
  "properties": {
    "type": {
      "type": "string",
      "enum": ["MESSAGE", "LOGIN", "LOGOUT", "JOIN_CHANNEL", "LEAVE_CHANNEL", "USER_ACTION"]
    },
    "timestamp": {
      "type": "string",
      "format": "date-time"
    },
    "userId": {
      "type": "string",
      "minLength": 1,
      "maxLength": 100
    },
    "payload": {
      "type": "object",
      "properties": {
        "channel": {
          "type": "string"
        },
        "message": {
          "type": "string"
        },
        "action": {
          "type": "string"
        }
      }
    }
  },
  "additionalProperties": false
} 